scan_date,project,package,version,cve_id,severity,title,fix_version,url
2026-04-09,01_direct_vuln_n1,org.apache.commons:commons-lang3,3.11,CVE-2025-48924,LOW,Apache Commons Lang is vulnerable to Uncontrolled Recursion when processing long inputs,,https://nvd.nist.gov/vuln/detail/CVE-2025-48924
2026-04-09,01_direct_vuln_n1,org.apache.commons:commons-text,1.9,CVE-2022-42889,LOW,Arbitrary code execution in Apache Commons Text,,https://nvd.nist.gov/vuln/detail/CVE-2022-42889
2026-04-09,01_direct_vuln_n1,org.apache.logging.log4j:log4j-core,2.14.1,CVE-2021-45046,LOW,Incomplete fix for Apache Log4j vulnerability,,https://nvd.nist.gov/vuln/detail/CVE-2021-45046
2026-04-09,01_direct_vuln_n1,org.apache.logging.log4j:log4j-core,2.14.1,CVE-2021-44832,LOW,Improper Input Validation and Injection in Apache Log4j2,,https://nvd.nist.gov/vuln/detail/CVE-2021-44832
2026-04-09,01_direct_vuln_n1,org.apache.logging.log4j:log4j-core,2.14.1,CVE-2021-44228,LOW,Remote code injection in Log4j,,https://nvd.nist.gov/vuln/detail/CVE-2021-44228
2026-04-09,01_direct_vuln_n1,org.apache.logging.log4j:log4j-core,2.14.1,CVE-2021-45105,LOW,Apache Log4j2 vulnerable to Improper Input Validation and Uncontrolled Recursion,,https://nvd.nist.gov/vuln/detail/CVE-2021-45105
2026-04-09,01_direct_vuln_n1,org.apache.logging.log4j:log4j-core,2.14.1,CVE-2025-68161,MEDIUM,Apache Log4j does not verify the TLS hostname in its Socket Appender,,https://nvd.nist.gov/vuln/detail/CVE-2025-68161
