scan_date,project,package,version,cve_id,severity,title,fix_version,url
2026-04-09,04_transitive_only_n3,commons-beanutils:commons-beanutils,1.9.3,CVE-2014-0114,HIGH,1: Class Loader manipulation via request parameters,1.9.4,https://avd.aquasec.com/nvd/cve-2014-0114
2026-04-09,04_transitive_only_n3,commons-beanutils:commons-beanutils,1.9.3,CVE-2019-10086,HIGH,apache-commons-beanutils: does not suppresses the class property in PropertyUtilsBean by default,1.9.4,https://avd.aquasec.com/nvd/cve-2019-10086
2026-04-09,04_transitive_only_n3,commons-beanutils:commons-beanutils,1.9.3,CVE-2025-48734,HIGH,commons-beanutils: Apache Commons BeanUtils: PropertyUtilsBean does not suppresses an enum's declaredClass property by default,1.11.0,https://avd.aquasec.com/nvd/cve-2025-48734
2026-04-09,04_transitive_only_n3,commons-collections:commons-collections,3.2.1,CVE-2015-7501,CRITICAL,apache-commons-collections: InvokerTransformer code execution during deserialisation,3.2.2,https://avd.aquasec.com/nvd/cve-2015-7501
2026-04-09,04_transitive_only_n3,commons-collections:commons-collections,3.2.1,CVE-2015-6420,HIGH,Insecure Deserialization in Apache Commons Collection,3.2.2,https://avd.aquasec.com/nvd/cve-2015-6420
